SQL> TABLE pack
SP2-0042: unknown command "TABLE pack" - rest of line ignored.
SQL> CREATE TABLE pack
  2  (
  3  packID NUMBER
  4  );
CREATE TABLE pack
             *
ERROR at line 1:
ORA-00955: name is already used by an existing object 


SQL> INSERT INTO pack VALUES('A123','3x.week',3,1400,'3months');

1 row created.

SQL> INSERT INTO pack VALUES('B124','6x.week',6,2000,'6months');

1 row created.

SQL> SELECT*FROM pack;

PACKAGEID                                                                       
--------------------------------------------------------------------------------
PACKAGENAME                                                                     
--------------------------------------------------------------------------------
  DURATION     AMOUNT                                                           
---------- ----------                                                           
PACKDESC                                                                        
--------------------------------------------------------------------------------
A123                                                                            
3x.week                                                                         
         3       1400                                                           
3months                                                                         
                                                                                

PACKAGEID                                                                       
--------------------------------------------------------------------------------
PACKAGENAME                                                                     
--------------------------------------------------------------------------------
  DURATION     AMOUNT                                                           
---------- ----------                                                           
PACKDESC                                                                        
--------------------------------------------------------------------------------
B124                                                                            
6x.week                                                                         
         6       2000                                                           
6months                                                                         
                                                                                

SQL> SELECT packagename,amount FROM pack;

PACKAGENAME                                                                     
--------------------------------------------------------------------------------
    AMOUNT                                                                      
----------                                                                      
3x.week                                                                         
      1400                                                                      
                                                                                
6x.week                                                                         
      2000                                                                      
                                                                                

SQL> UPDATE pack SET amount = amount + 1000;

2 rows updated.

SQL> SELECT*FROM pack;

PACKAGEID                                                                       
--------------------------------------------------------------------------------
PACKAGENAME                                                                     
--------------------------------------------------------------------------------
  DURATION     AMOUNT                                                           
---------- ----------                                                           
PACKDESC                                                                        
--------------------------------------------------------------------------------
A123                                                                            
3x.week                                                                         
         3       2400                                                           
3months                                                                         
                                                                                

PACKAGEID                                                                       
--------------------------------------------------------------------------------
PACKAGENAME                                                                     
--------------------------------------------------------------------------------
  DURATION     AMOUNT                                                           
---------- ----------                                                           
PACKDESC                                                                        
--------------------------------------------------------------------------------
B124                                                                            
6x.week                                                                         
         6       3000                                                           
6months                                                                         
                                                                                

SQL> DELETE FROM pack WHERE duration = 6;

1 row deleted.

SQL> SELECT*FROM pack;

PACKAGEID                                                                       
--------------------------------------------------------------------------------
PACKAGENAME                                                                     
--------------------------------------------------------------------------------
  DURATION     AMOUNT                                                           
---------- ----------                                                           
PACKDESC                                                                        
--------------------------------------------------------------------------------
A123                                                                            
3x.week                                                                         
         3       2400                                                           
3months                                                                         
                                                                                

SQL> Spool off
